{
  "$schema": "http://json-schema.org/draft-07/schema#",
  "title": "plugin.json v2（docs/PLUGIN.md §5.3/§5.5：一个插件一个文件——身份 + 客户端登记；宿主自有插件无 version；⛔ 不放路径映射、不放 slot/order（位置归宿主 apps/plugins/host.json）、不放业务逻辑）",
  "type": "object",
  "additionalProperties": false,
  "required": ["schemaVersion", "id"],
  "properties": {
    "schemaVersion": { "const": 2 },
    "id": { "type": "string", "pattern": "^[a-z][A-Za-z0-9]{0,63}$" },
    "version": { "type": "string", "pattern": "^(0|[1-9][0-9]*)\\.(0|[1-9][0-9]*)\\.(0|[1-9][0-9]*)$" },
    "description": { "type": "string", "pattern": "^.{0,200}$" },
    "domains": {
      "type": "array",
      "items": { "type": "string", "pattern": "^[a-z][A-Za-z0-9]{0,63}$" }
    },
    "fguiPackages": {
      "type": "array",
      "items": { "type": "string", "pattern": "^[A-Za-z0-9_]{1,64}$" }
    },
    "category": { "type": "string", "pattern": "^(core|extra)$" },
    "docs": {
      "type": "array",
      "items": { "type": "string", "pattern": "^[A-Za-z0-9][A-Za-z0-9_/.-]*\\.md$" }
    },
    "capabilities": {
      "type": "array",
      "items": {
        "type": "object",
        "additionalProperties": false,
        "required": ["id", "category", "defaultEntry", "sourceOfTruth", "wireBoundary", "verification", "docs"],
        "properties": {
          "id": { "type": "string", "pattern": "^[a-z][a-z0-9-]{0,63}$" },
          "category": { "type": "string", "pattern": "^(core|extra)$" },
          "defaultEntry": { "type": "string", "pattern": "^[A-Za-z0-9][A-Za-z0-9_/.-]*$" },
          "sourceOfTruth": { "type": "string", "pattern": "^[A-Za-z0-9][A-Za-z0-9_/.-]*$" },
          "wireBoundary": { "type": "string", "pattern": "^[A-Za-z0-9][A-Za-z0-9_/.-]*$" },
          "verification": { "type": "array", "items": { "type": "object" } },
          "docs": { "type": "array", "items": { "type": "string", "pattern": "^[A-Za-z0-9][A-Za-z0-9_/.-]*\\.md$" } },
          "launch": { "type": "object" }
        }
      }
    },
    "resident": { "type": "boolean" },
    "requires": {
      "type": "object",
      "additionalProperties": false,
      "properties": {
        "pluginApiVersion": { "type": "integer", "minimum": 1 },
        "kits": {
          "type": "object",
          "additionalProperties": false,
          "patternProperties": {
            "^[a-z][A-Za-z0-9]{0,63}$": {
              "type": "object",
              "additionalProperties": false,
              "patternProperties": { "^[a-z][A-Za-z0-9]{0,63}$": { "type": "integer", "minimum": 1 } }
            }
          }
        }
      }
    },
    "contributes": {
      "type": "object",
      "additionalProperties": false,
      "patternProperties": {
        "^[a-z][A-Za-z0-9]{0,63}$": {
          "type": "object",
          "additionalProperties": false,
          "patternProperties": {
            "^[a-z][A-Za-z0-9]{0,63}$": { "type": "string", "pattern": "^apps/(plugins|client/src|server/src|shared/src)/[A-Za-z0-9][A-Za-z0-9_/.-]*\\.(ts|json)$" }
          }
        }
      }
    },
    "entry": { "type": "string", "pattern": "^apps/client/src/plugins/[a-z][A-Za-z0-9]{0,63}/index\\.ts$" },
    "dependencies": {
      "type": "array",
      "items": { "type": "string", "pattern": "^[a-z][A-Za-z0-9]{0,63}$" }
    },
    "viewDirs": {
      "type": "array",
      "items": { "type": "string", "pattern": "^apps/client/src/[A-Za-z0-9_/.-]+$" }
    },
    "views": {
      "type": "array",
      "items": { "type": "string", "pattern": "^apps/client/src/[A-Za-z0-9_/.-]+View\\.view\\.json$" }
    },
    "owners": {
      "type": "array",
      "items": {
        "type": "object",
        "additionalProperties": false,
        "required": ["id", "logicDir"],
        "properties": {
          "id": { "type": "string", "pattern": "^[a-z][A-Za-z0-9]{0,63}$" },
          "logicDir": { "type": "string", "pattern": "^apps/client/src/(logic|plugins)/[A-Za-z0-9_/.-]+$" }
        }
      }
    },
    "routes": {
      "type": "array",
      "items": {
        "type": "object",
        "additionalProperties": false,
        "required": ["id", "view"],
        "properties": {
          "id": { "type": "string", "pattern": "^[a-z][A-Za-z0-9]{0,63}$" },
          "view": { "type": "string", "pattern": "^[A-Z][A-Za-z0-9]{0,63}$" }
        }
      }
    },
    "menu": {
      "type": "array",
      "items": {
        "type": "object",
        "additionalProperties": false,
        "required": ["entryId", "label", "labelKey", "launch"],
        "properties": {
          "entryId": { "type": "string", "pattern": "^[a-z][A-Za-z0-9]{0,63}$" },
          "label": { "type": "string", "pattern": "^.{1,64}$" },
          "labelKey": { "type": "string", "pattern": "^[a-z][A-Za-z0-9.]{0,127}$" },
          "icon": { "type": "string", "pattern": "^ui://[A-Za-z0-9_]+/[A-Za-z0-9_.-]+$" },
          "launch": {
            "type": "object",
            "additionalProperties": false,
            "required": ["kind"],
            "properties": {
              "kind": { "type": "string", "pattern": "^(gameplay|route)$" },
              "gameplayId": { "type": "string", "pattern": "^[a-z][A-Za-z0-9]{0,63}$" },
              "routeId": { "type": "string", "pattern": "^[a-z][A-Za-z0-9]{0,63}$" },
              "payload": { "type": "object" },
              "profile": { "type": "string", "pattern": "^[A-Za-z0-9][A-Za-z0-9._-]{0,63}$" }
            }
          }
        }
      }
    }
  }
}
